{
  "id": "sample-3",
  "version": 1,
  "displayName": "Denim Jacket",
  "width": 512,
  "height": 512,
  "anchors": {
    "collar_left": [0.32, 0.10],
    "collar_right": [0.68, 0.10],
    "hem_center": [0.50, 0.85]
  },
  "body_offsets": {
    "neck_drop_ratio": 0.05,
    "torso_length_ratio": 1.00
  }
}
