{
  "id": "sample-1",
  "version": 1,
  "displayName": "White T-Shirt",
  "width": 512,
  "height": 512,
  "anchors": {
    "collar_left": [0.30, 0.12],
    "collar_right": [0.70, 0.12],
    "hem_center": [0.50, 0.88]
  },
  "body_offsets": {
    "neck_drop_ratio": 0.06,
    "torso_length_ratio": 1.05
  }
}
